{
  "$schema": "../../schema/youi.component.schema.json",
  "schema": "youi.component/v1",
  "id": "youi:signal/component/button",
  "name": "Button",
  "version": "1.0.0",
  "status": "stable",
  "summary": "Every act a person can take. Ink by default; attention only for the one verb that settles a wait.",
  "source": {
    "file": "button/button.tsx",
    "export": "Button",
    "also": []
  },
  "platforms": [
    "web"
  ],
  "passthrough": "button",
  "props": {
    "variant": {
      "type": "enum",
      "values": [
        "default",
        "attention",
        "destructive",
        "outline",
        "secondary",
        "ghost",
        "link"
      ],
      "default": "default",
      "description": "default = ink act; attention = the single verb that resolves a wait (max one per screen); outline = row actions, page tools and secondary choices; ghost = toolbars and far-away destructive text buttons; destructive = a confirmed destructive act. secondary and link exist in code but Signal's DESIGN.md does not describe them: prefer outline (secondary choices) and a plain link (navigation)."
    },
    "size": {
      "type": "enum",
      "values": [
        "default",
        "sm",
        "lg",
        "icon"
      ],
      "default": "default",
      "description": "32px (28px sm) at a desk; every size becomes 44px on phones."
    },
    "asChild": {
      "type": "boolean",
      "default": false,
      "description": "Style the single child (e.g. an <a>) as the button instead of rendering <button>."
    },
    "className": {
      "type": "string",
      "description": "Extra classes, merged last with cn(); use token utilities only."
    },
    "children": {
      "type": "node"
    },
    "onClick": {
      "type": "function"
    }
  },
  "tokens": {
    "bg.default": "youi:signal/token/color.accent",
    "fg.default": "youi:signal/token/color.on-accent",
    "bg.attention": "youi:signal/token/color.attention",
    "fg.attention": "youi:signal/token/color.on-attention",
    "bg.destructive": "youi:signal/token/color.danger-soft",
    "fg.destructive": "youi:signal/token/color.danger",
    "shadow.outline": "youi:signal/token/shadow.pill",
    "radius": "youi:signal/token/radius.md",
    "text": "youi:signal/token/typography.label"
  },
  "a11y": {
    "role": "button",
    "minTouchTarget": 44,
    "notes": [
      "size=\"icon\" has no visible text: give it aria-label.",
      "Focus is a 2px ring at a 2px offset; never remove it.",
      "Disabled drops to 50% opacity and ignores pointer events."
    ]
  },
  "rules": [
    "youi:signal/rule/color.no-raw-color",
    "youi:signal/rule/tokens.no-arbitrary-values",
    "youi:signal/rule/components.canonical-import",
    "youi:signal/rule/props.contract-values",
    "youi:signal/rule/components.no-native-controls"
  ],
  "guidance": {
    "do": [
      "Use variant=\"outline\" for row actions and page tools.",
      "Use variant=\"attention\" only for the verb that settles a wait, once per screen.",
      "Put a trailing arrow icon on go-acts."
    ],
    "dont": [
      "Don't render a raw <button> with hand-written classes.",
      "Don't make a recommended option attention; a recommendation is not urgency.",
      "Don't colour a failure with the accent; failure is destructive (vermilion)."
    ]
  },
  "examples": [
    {
      "title": "Row action",
      "code": "<Button variant=\"outline\" size=\"sm\">Open <ArrowRight /></Button>"
    },
    {
      "title": "The one verb that settles a wait",
      "code": "<Button variant=\"attention\">Approve</Button>"
    },
    {
      "title": "Link styled as a button",
      "code": "<Button asChild variant=\"outline\"><a href=\"/work\">Open tasks</a></Button>"
    }
  ],
  "aliases": [
    "buttonVariants"
  ],
  "owners": [
    "group:design-system"
  ]
}
